<?xml version="1.0" encoding="UTF-8"?>
<person xmlns:xsi="http://www.w3.org/2001/XMLSchema-instance"
 xsi:noNamespaceSchemaLocation="person.xsd" id="turing">
	<name>
		<first>Alan</first>
		<last>Turing</last>
	</name>
	<birth>2001-01-01</birth>
	<death>2001-01-01</death>
	<profession>Computer Scientist</profession>
	<profession>Mathematician</profession>
	<profession>Crypographer</profession>
</person>